{
  "esquema": "norma.v1",
  "id": "cr/ley/2021/9986",
  "tipo": "ley",
  "numero": "9986",
  "titulo": "Ley General de Contratación Pública",
  "titulo_tipo": "oficial",
  "emisor": "Asamblea Legislativa",
  "publicacion": {
    "diario": "La Gaceta, Diario Oficial de Costa Rica",
    "gaceta": 103,
    "alcance": 109,
    "fecha": "2021-05-31"
  },
  "procedencia": {
    "declaracion": "El contenido de este registro se descargó del Diario Oficial La Gaceta, edición oficial publicada por la Imprenta Nacional de Costa Rica, en el PDF indicado en url_pdf.",
    "fuente": "Imprenta Nacional de Costa Rica — La Gaceta (edición oficial)",
    "url_pdf": "https://www.imprentanacional.go.cr/pub/2021/05/31/ALCA109_31_05_2021.pdf",
    "fecha_descarga": "2026-10-08",
    "sha256_pdf": "3ea2bd44b9224a56af62c09af71443ee4863c7c8c36f458ec927915444e9b00a",
    "bytes_pdf": 4811003,
    "paginas": [
      2,
      98
    ],
    "localizacion": "Dato de publicación citado en el considerando del Decreto 43808-H (La Gaceta); verificado en el PDF."
  },
  "texto": {
    "incluido": false,
    "motivo_no_incluido": "El PDF oficial publica esta ley como imagen escaneada; el reconocimiento de caracteres tiene errores que alteran el contenido (p. ej. montos en colones como «(<C238 223 960)», capítulos «11» y «111» por II y III, «serv1c1os»). Se publican metadatos y enlace hasta contar con una transcripción revisada."
  },
  "relaciones": []
}
